{
  "$schema": "https://json-schema.org/draft/2020-12/schema",
  "$id": "https://github.com/danielfrey63/orggraph/schema/registry.schema.json",
  "title": "OrgGraph canonical type registry",
  "description": "Curated, versioned type registry (PRD FR-4.1). Declares node and edge types with declarative capabilities; the app engine itself is type-agnostic (PRD FR-4.2, NFR-5). Dataset schemas in snapshots are subsets of this registry (PRD FR-3.4).",
  "type": "object",
  "required": ["version", "nodeTypes", "edgeTypes"],
  "additionalProperties": false,
  "properties": {
    "$comment": { "type": "string" },
    "version": {
      "type": "string",
      "description": "Registry version stamp; copied into snapshot meta.registryVersion (PRD FR-6.1b)."
    },
    "nodeTypes": {
      "type": "object",
      "description": "Node type name -> capabilities. Names are data, never referenced in engine code (PRD NFR-5); they must be path-safe identifiers so every type is addressable in view path expressions (PRD E58).",
      "propertyNames": { "pattern": "^\\p{L}[\\p{L}\\p{N}_]*$" },
      "additionalProperties": { "$ref": "#/$defs/nodeType" }
    },
    "edgeTypes": {
      "type": "object",
      "description": "Edge type name -> declaration. Names must be path-safe identifiers (PRD E58).",
      "propertyNames": { "pattern": "^\\p{L}[\\p{L}\\p{N}_]*$" },
      "additionalProperties": { "$ref": "#/$defs/edgeType" }
    }
  },
  "$defs": {
    "nodeType": {
      "type": "object",
      "additionalProperties": false,
      "properties": {
        "description": { "type": "string" },
        "labelProp": {
          "type": "string",
          "default": "label",
          "description": "Path resolved as display name: \"label\" or a scalar props path like \"props.displayName\" (PRD FR-4.2b). If absent, \"label\" applies; if it resolves to a missing or non-scalar value, display falls back to \"label\" and the import warns."
        },
        "identifiers": {
          "type": "array",
          "items": { "type": "string" },
          "description": "Searchable/matchable identifier paths, e.g. \"id\" or \"props.email\" (search, import matching)."
        },
        "leafProp": {
          "type": "string",
          "description": "Path to the boolean property marking leaf nodes, in the same path notation as identifiers (e.g. \"props.isBasis\"); drives the type-agnostic leaf filter (PRD FR-8.3)."
        },
        "groupProp": {
          "type": "string",
          "description": "Props path (e.g. \"props.kategorie\") whose value groups ring badges of this type in the legend instead of the type name (PRD E74); a missing or non-string value falls back to the type name."
        },
        "pseudonymize": {
          "type": "object",
          "additionalProperties": false,
          "required": ["pool"],
          "properties": {
            "pool": {
              "type": "string",
              "description": "Name of the pseudonym pool in the tenant's pseudo data."
            },
            "byLevel": {
              "type": "boolean",
              "default": false,
              "description": "Pick pool entries by BFS level (PRD FR-8.5)."
            }
          },
          "description": "Selects the nicer, type-specific pseudonym pool. Types WITHOUT this capability still get the deterministic fail-closed fallback \"<Typname> N\" when pseudonymization is active (PRD E48, FR-8.5). Presentation (colors, icons) is intentionally NOT part of the registry (PRD FR-4.2a / E13)."
        },
        "props": {
          "type": "object",
          "description": "Optional declarations for node-type props; implies is edge-only (PRD E63).",
          "additionalProperties": {
            "allOf": [
              { "$ref": "#/$defs/propDecl" },
              { "not": { "required": ["implies"] } }
            ]
          }
        }
      }
    },
    "edgeType": {
      "type": "object",
      "additionalProperties": false,
      "required": ["from", "to"],
      "properties": {
        "description": { "type": "string" },
        "from": { "$ref": "#/$defs/endpoint" },
        "to": { "$ref": "#/$defs/endpoint" },
        "identityProps": {
          "type": "array",
          "items": { "type": "string" },
          "description": "Props that are part of the edge identity in addition to type+source+target (PRD FR-5.2 / E15); typically reference props such as \"kontext\"."
        },
        "props": { "$ref": "#/$defs/propDecls" }
      }
    },
    "endpoint": {
      "description": "Allowed endpoint type(s); \"*\" = any (PRD FR-3.4).",
      "oneOf": [
        { "type": "string" },
        { "type": "array", "items": { "type": "string" }, "minItems": 1 }
      ]
    },
    "propDecls": {
      "type": "object",
      "description": "Declarations for individual props. Every props key used by snapshots MUST be declared here (minimal decl: {}); the import rejects used keys unknown to the tenant registry — the registry is the single source of truth down to field level (PRD FR-4.5, FR-3.4, FR-6.8).",
      "additionalProperties": { "$ref": "#/$defs/propDecl" }
    },
    "propDecl": {
      "type": "object",
      "additionalProperties": false,
      "properties": {
        "description": { "type": "string" },
        "type": {
          "enum": ["string", "number", "boolean", "date"],
          "description": "Scalar type hint; import validation warns on mismatch, never silently drops."
        },
        "ref": {
          "type": "string",
          "description": "Node type this prop references; the value is a node id (PRD FR-4.7). The only exception to the scalar principle."
        },
        "implies": {
          "type": "string",
          "description": "Edge type derived from this reference as a PROJECTION contribution (PRD FR-4.8, E33, E52): the base edge's validity is the union of the intervals of ALL primary facts implying the same identity (plus any directly delivered contribution) — never a one-to-one interval copy, never an independent closure candidate; it ends only when no valid primary fact implies it anymore. Requires ref."
        },
        "nonSensitive": {
          "type": "boolean",
          "default": false,
          "description": "Whitelist flag for pseudo mode (PRD E60): only props marked nonSensitive stay visible in tooltips, search results, legends, reference labels, and exports while pseudonymization is active."
        }
      },
      "dependentRequired": { "implies": ["ref"] },
      "not": {
        "required": ["ref", "type"],
        "$comment": "A reference prop holds a node id; combining ref with a scalar type hint is contradictory."
      }
    }
  }
}
